{
  "gate": "material-optimization",
  "artifactId": "a320-cockpit-2-material-optimization-001",
  "createdAt": "2026-07-09T08:25:22Z",
  "assetPath": "art-source/cockpit-pipeline/builds/shaded/a320-cockpit-2-shading/a320-cockpit-2-shaded.glb",
  "materialCount": 11,
  "textureReports": [
    {
      "path": "Viewer Node",
      "width": 256,
      "height": 256,
      "usage": "preserved imported source texture"
    },
    {
      "path": "m0mat_003_baseColor",
      "width": 1024,
      "height": 1024,
      "usage": "preserved imported source texture"
    },
    {
      "path": "m0mat_004_baseColor",
      "width": 2048,
      "height": 2048,
      "usage": "preserved imported source texture"
    },
    {
      "path": "m0mat_005_baseColor",
      "width": 2048,
      "height": 2048,
      "usage": "preserved imported source texture"
    },
    {
      "path": "m0mat_006_baseColor",
      "width": 512,
      "height": 512,
      "usage": "preserved imported source texture"
    },
    {
      "path": "m0mat_007_baseColor",
      "width": 512,
      "height": 512,
      "usage": "preserved imported source texture"
    },
    {
      "path": "m0mat_008_baseColor",
      "width": 1024,
      "height": 1024,
      "usage": "preserved imported source texture"
    },
    {
      "path": "m0mat_009_baseColor",
      "width": 2048,
      "height": 2048,
      "usage": "preserved imported source texture"
    },
    {
      "path": "m0mat_baseColor",
      "width": 2048,
      "height": 2048,
      "usage": "preserved imported source texture"
    },
    {
      "path": "m1mat_001_baseColor",
      "width": 1024,
      "height": 1024,
      "usage": "preserved imported source texture"
    },
    {
      "path": "m1mat_baseColor",
      "width": 1024,
      "height": 1024,
      "usage": "preserved imported source texture"
    }
  ],
  "glbSizeBytes": 39849104,
  "optimizationDecision": "Preservation-first A320 source-parity pass. Source texture node links, UVs, mesh hierarchy, and runtime metadata are preserved; no mesh joining, decimation, UV rebake, or destructive GLB optimization.",
  "destructiveOptimizationUsed": false,
  "runtimeContractPreserved": true,
  "reimportValidation": "pass"
}
